[
  {
    "order_id": "ORD-000232",
    "customer_id": "CUS-0025",
    "order_date": "2026-07-03",
    "exported_at": "2026-07-03T23:03:54Z",
    "amount": 49971.68,
    "currency": "INR",
    "status": "PAID",
    "country_code": "IN",
    "source_system": "ACME_COMMERCE"
  },
  {
    "order_id": "ORD-000293",
    "customer_id": "CUS-0032",
    "order_date": "2026-07-03",
    "exported_at": "2026-07-03T23:06:38Z",
    "amount": 178660.72,
    "currency": "INR",
    "status": "PAID",
    "country_code": "IN",
    "source_system": "ACME_COMMERCE"
  },
  {
    "order_id": "ORD-000265",
    "customer_id": "CUS-0037",
    "order_date": "2026-07-03",
    "exported_at": "2026-07-03T23:09:46Z",
    "amount": 129074.57,
    "currency": "INR",
    "status": "PAID",
    "country_code": "IN",
    "source_system": "ACME_COMMERCE"
  },
  {
    "order_id": "ORD-000269",
    "customer_id": "CUS-0023",
    "order_date": "2026-07-03",
    "exported_at": "2026-07-03T23:01:08Z",
    "amount": 106620.87,
    "currency": "INR",
    "status": "CANCELLED",
    "country_code": "IN",
    "source_system": "ACME_COMMERCE"
  },
  {
    "order_id": "ORD-000233",
    "customer_id": "CUS-0014",
    "order_date": "2026-07-03",
    "exported_at": "2026-07-03T23:01:19Z",
    "amount": 125308.01,
    "currency": "INR",
    "status": "PENDING",
    "country_code": "IN",
    "source_system": "ACME_COMMERCE"
  },
  {
    "order_id": "ORD-000230",
    "customer_id": "CUS-0035",
    "order_date": "2026-07-03",
    "exported_at": "2026-07-03T23:05:17Z",
    "amount": 224011.71,
    "currency": "INR",
    "status": "REFUNDED",
    "country_code": "IN",
    "source_system": "ACME_COMMERCE"
  },
  {
    "order_id": "ORD-000211",
    "customer_id": "CUS-0038",
    "order_date": "2026-07-03",
    "exported_at": "2026-07-03T23:04:29Z",
    "amount": 223474.5,
    "currency": "USD",
    "status": "PAID",
    "country_code": "US",
    "source_system": "ACME_COMMERCE"
  },
  {
    "order_id": "ORD-000215",
    "customer_id": "CUS-0033",
    "order_date": "2026-07-03",
    "exported_at": "2026-07-03T23:03:25Z",
    "amount": 92812.3,
    "currency": "INR",
    "status": "PAID",
    "country_code": "IN",
    "source_system": "ACME_COMMERCE"
  },
  {
    "order_id": "ORD-000274",
    "customer_id": "CUS-0040",
    "order_date": "2026-07-03",
    "exported_at": "2026-07-03T23:08:48Z",
    "amount": 135317.62,
    "currency": "USD",
    "status": "REFUNDED",
    "country_code": "US",
    "source_system": "ACME_COMMERCE"
  },
  {
    "order_id": "ORD-000246",
    "customer_id": "CUS-0018",
    "order_date": "2026-07-03",
    "exported_at": "2026-07-03T23:06:03Z",
    "amount": 129052.8,
    "currency": "USD",
    "status": "PAID",
    "country_code": "US",
    "source_system": "ACME_COMMERCE"
  },
  {
    "order_id": "ORD-000229",
    "customer_id": "CUS-0040",
    "order_date": "2026-07-03",
    "exported_at": "2026-07-03T23:00:01Z",
    "amount": 138808.16,
    "currency": "USD",
    "status": "CANCELLED",
    "country_code": "US",
    "source_system": "ACME_COMMERCE"
  },
  {
    "order_id": "ORD-000275",
    "customer_id": "CUS-0012",
    "order_date": "2026-07-03",
    "exported_at": "2026-07-03T23:03:19Z",
    "amount": 236790.13,
    "currency": "INR",
    "status": "REFUNDED",
    "country_code": "IN",
    "source_system": "ACME_COMMERCE"
  },
  {
    "order_id": "ORD-000239",
    "customer_id": "CUS-0019",
    "order_date": "2026-07-03",
    "exported_at": "2026-07-03T23:03:56Z",
    "amount": 68675.65,
    "currency": "INR",
    "status": "CANCELLED",
    "country_code": "IN",
    "source_system": "ACME_COMMERCE"
  },
  {
    "order_id": "ORD-000283",
    "customer_id": "CUS-0027",
    "order_date": "2026-07-03",
    "exported_at": "2026-07-03T23:09:25Z",
    "amount": 110941.77,
    "currency": "INR",
    "status": "PENDING",
    "country_code": "IN",
    "source_system": "ACME_COMMERCE"
  },
  {
    "order_id": "ORD-000258",
    "customer_id": "CUS-0013",
    "order_date": "2026-07-03",
    "exported_at": "2026-07-03T23:03:05Z",
    "amount": 46165.88,
    "currency": "INR",
    "status": "CANCELLED",
    "country_code": "IN",
    "source_system": "ACME_COMMERCE"
  },
  {
    "order_id": "ORD-000213",
    "customer_id": "CUS-0027",
    "order_date": "2026-07-03",
    "exported_at": "2026-07-03T23:02:32Z",
    "amount": 181657.24,
    "currency": "USD",
    "status": "CANCELLED",
    "country_code": "US",
    "source_system": "ACME_COMMERCE"
  },
  {
    "order_id": "ORD-000235",
    "customer_id": "CUS-0015",
    "order_date": "2026-07-03",
    "exported_at": "2026-07-03T23:07:47Z",
    "amount": 77665.59,
    "currency": "USD",
    "status": "CANCELLED",
    "country_code": "US",
    "source_system": "ACME_COMMERCE"
  },
  {
    "order_id": "ORD-000217",
    "customer_id": "CUS-0028",
    "order_date": "2026-07-03",
    "exported_at": "2026-07-03T23:02:23Z",
    "amount": 28935.94,
    "currency": "INR",
    "status": "CANCELLED",
    "country_code": "IN",
    "source_system": "ACME_COMMERCE"
  },
  {
    "order_id": "ORD-000248",
    "customer_id": "CUS-0023",
    "order_date": "2026-07-03",
    "exported_at": "2026-07-03T23:07:02Z",
    "amount": 67783.08,
    "currency": "INR",
    "status": "PENDING",
    "country_code": "IN",
    "source_system": "ACME_COMMERCE"
  },
  {
    "order_id": "ORD-000287",
    "customer_id": "CUS-0007",
    "order_date": "2026-07-03",
    "exported_at": "2026-07-03T23:09:35Z",
    "amount": 103003.83,
    "currency": "USD",
    "status": "PAID",
    "country_code": "US",
    "source_system": "ACME_COMMERCE"
  },
  {
    "order_id": "ORD-000212",
    "customer_id": "CUS-0029",
    "order_date": "2026-07-03",
    "exported_at": "2026-07-03T23:04:36Z",
    "amount": 150569.91,
    "currency": "USD",
    "status": "REFUNDED",
    "country_code": "US",
    "source_system": "ACME_COMMERCE"
  },
  {
    "order_id": "ORD-000236",
    "customer_id": "CUS-0039",
    "order_date": "2026-07-03",
    "exported_at": "2026-07-03T23:08:31Z",
    "amount": 25690.72,
    "currency": "INR",
    "status": "PAID",
    "country_code": "IN",
    "source_system": "ACME_COMMERCE"
  },
  {
    "order_id": "ORD-000280",
    "customer_id": "CUS-0021",
    "order_date": "2026-07-03",
    "exported_at": "2026-07-03T23:00:48Z",
    "amount": 245073.69,
    "currency": "INR",
    "status": "PAID",
    "country_code": "IN",
    "source_system": "ACME_COMMERCE"
  },
  {
    "order_id": "ORD-000254",
    "customer_id": "CUS-0003",
    "order_date": "2026-07-03",
    "exported_at": "2026-07-03T23:06:40Z",
    "amount": 89798.74,
    "currency": "INR",
    "status": "CANCELLED",
    "country_code": "IN",
    "source_system": "ACME_COMMERCE"
  },
  {
    "order_id": "ORD-000300",
    "customer_id": "CUS-0030",
    "order_date": "2026-07-03",
    "exported_at": "2026-07-03T23:01:24Z",
    "amount": 138542.52,
    "currency": "USD",
    "status": "PAID",
    "country_code": "US",
    "source_system": "ACME_COMMERCE"
  },
  {
    "order_id": "ORD-000257",
    "customer_id": "CUS-0030",
    "order_date": "2026-07-03",
    "exported_at": "2026-07-03T23:02:45Z",
    "amount": 207226.05,
    "currency": "INR",
    "status": "REFUNDED",
    "country_code": "IN",
    "source_system": "ACME_COMMERCE"
  },
  {
    "order_id": "ORD-000286",
    "customer_id": "CUS-0020",
    "order_date": "2026-07-03",
    "exported_at": "2026-07-03T23:09:56Z",
    "amount": 99841.16,
    "currency": "USD",
    "status": "CANCELLED",
    "country_code": "US",
    "source_system": "ACME_COMMERCE"
  },
  {
    "order_id": "ORD-000267",
    "customer_id": "CUS-0031",
    "order_date": "2026-07-03",
    "exported_at": "2026-07-03T23:07:02Z",
    "amount": 202206.35,
    "currency": "INR",
    "status": "PAID",
    "country_code": "IN",
    "source_system": "ACME_COMMERCE"
  },
  {
    "order_id": "ORD-000220",
    "customer_id": "CUS-0006",
    "order_date": "2026-07-03",
    "exported_at": "2026-07-03T23:00:19Z",
    "amount": 155919.21,
    "currency": "INR",
    "status": "CANCELLED",
    "country_code": "IN",
    "source_system": "ACME_COMMERCE"
  },
  {
    "order_id": "ORD-000256",
    "customer_id": "CUS-0011",
    "order_date": "2026-07-03",
    "exported_at": "2026-07-03T23:00:27Z",
    "amount": 229244.78,
    "currency": "INR",
    "status": "PENDING",
    "country_code": "IN",
    "source_system": "ACME_COMMERCE"
  },
  {
    "order_id": "ORD-000228",
    "customer_id": "CUS-0028",
    "order_date": "2026-07-03",
    "exported_at": "2026-07-03T23:06:55Z",
    "amount": 121152.0,
    "currency": "INR",
    "status": "PAID",
    "country_code": "IN",
    "source_system": "ACME_COMMERCE"
  },
  {
    "order_id": "ORD-000272",
    "customer_id": "CUS-0007",
    "order_date": "2026-07-03",
    "exported_at": "2026-07-03T23:08:48Z",
    "amount": 100011.44,
    "currency": "INR",
    "status": "PENDING",
    "country_code": "IN",
    "source_system": "ACME_COMMERCE"
  },
  {
    "order_id": "ORD-000242",
    "customer_id": "CUS-0015",
    "order_date": "2026-07-03",
    "exported_at": "2026-07-03T23:04:00Z",
    "amount": 150560.64,
    "currency": "INR",
    "status": "CANCELLED",
    "country_code": "IN",
    "source_system": "ACME_COMMERCE"
  },
  {
    "order_id": "ORD-000231",
    "customer_id": "CUS-0030",
    "order_date": "2026-07-03",
    "exported_at": "2026-07-03T23:01:56Z",
    "amount": 178297.2,
    "currency": "INR",
    "status": "REFUNDED",
    "country_code": "IN",
    "source_system": "ACME_COMMERCE"
  },
  {
    "order_id": "ORD-000240",
    "customer_id": "CUS-0027",
    "order_date": "2026-07-03",
    "exported_at": "2026-07-03T23:07:16Z",
    "amount": 133588.29,
    "currency": "INR",
    "status": "PAID",
    "country_code": "IN",
    "source_system": "ACME_COMMERCE"
  },
  {
    "order_id": "ORD-000207",
    "customer_id": "CUS-0009",
    "order_date": "2026-07-03",
    "exported_at": "2026-07-03T23:02:41Z",
    "amount": 21301.1,
    "currency": "INR",